<?xml version="1.0" encoding="UTF-8" standalone="yes"?>
<store xmlns:xsi="http://www.w3.org/2001/XMLSchema-instance" xsi:noNamespaceSchemaLocation="validate.xsd">
  <information id="1">
    <name>Nintendo Novel Nook</name>
    <description> Immerse yourself in the fantastical worlds of gaming and storytelling at Nintendo Novel Nook. Uncover hidden gems and classic favorites inspired by beloved video game franchises. Whether you're a Mario aficionado, a Zelda enthusiast, or a Pokémon trainer, embark on epic literary adventures that capture the magic of Nintendo.</description>
    <owner userId="43">John Doe</owner>
  </information>
  <products>
    <product id="NINTENDO1" language="En" edition="1st">
      <title>Super Mario Encyclopedia</title>
      <author>Nintendo</author>
      <isbn>10: 0-13-822139-1</isbn>
      <sku>13: 978-0-13-822139-3</sku>
      <description> Super Mario Bros. Encyclopedia: The Official Guide to the First 30 Years is jam-packed with content from all seventeen Super Mario games</description>
      <price currency="USD">21</price>
      <department>NINTENDO</department>
      <modules>
        <module id="NINTENDO" name="NINTENDO 101"/>
      </modules>
      <availability>In Stock</availability>
      <condition>Brand New</condition>
      <image>sample.jpg</image>
    </product>

    <product id="NINTENDO2" language="En" edition="1st">
      <title>The Essential Handbook for Nintendo Switch</title>
      <author>Mortimer Children's Books</author>
      <isbn>978-1525302381</isbn>
      <sku>1525302388</sku>
      <description>It's filled with everything a Switch owner needs to know</description>
      <price currency="USD">9.95</price>
      <department>NINTENDO</department>
      <modules>
        <module id="NINTENDO" name="NINTENDO 101"/>
      </modules>
      <availability>In Stock</availability>
      <condition>Great</condition>
      <image>NINTENDO.png</image>
    </product>

    <product id="NINTENDO3" language="En" edition="Deluxe">
      <title>The Legend of Zelda Encyclopedia</title>
      <author>Nintendo</author>
      <isbn>978-1525302381</isbn>
      <sku>1525302388</sku>
      <description>The Legend of Zelda is one of the most successful franchises of all time with nearly twenty video games and thirty years of history, but it all started with a gold cartridge...</description>
      <price currency="USD">46</price>
      <department>NINTENDO</department>
      <modules>
        <module id="NINTENDO" name="NINTENDO 101"/>
      </modules>
      <availability>Out of Stock</availability>
      <condition>New</condition>
      <image>NINTENDO.png</image>
    </product>

    <product id="NINTENDO4" language="En" edition="Unabridged">
      <title>Disrupting the Game: From the Bronx to the Top of Nintendo</title>
      <author>Reggie Fils-Aimé </author>
      <isbn>978-1525302381</isbn>
      <sku>1525302388</sku>
      <description>WALL STREET JOURNAL BESTSELLER</description>
      <price currency="USD">14.95</price>
      <department>NINTENDO</department>
      <modules>
        <module id="NINTENDO" name="NINTENDO 101"/>
      </modules>
      <availability>Out of Stock</availability>
      <condition>Great</condition>
      <image>NINTENDO.png</image>
    </product>

    <product id="NINTENDO5" language="En" edition="1st">
      <title>Console Wars: Sega Vs Nintendo</title>
      <author>Blake Harris</author>
      <isbn>978-1525302381</isbn>
      <sku>1525302388</sku>
      <description>In 1990 Nintendo had a virtual monopoly on the video game industry. Sega, on the other hand, was a faltering arcade company with big aspirations and even bigger personalities. </description>
      <price currency="USD">11.94</price>
      <department>NINTENDO</department>
      <modules>
        <module id="NINTENDO" name="NINTENDO 101"/>
      </modules>
      <availability>In Stock</availability>
      <condition>Good</condition>
      <image>NINTENDO.png</image>
    </product>

    <product id="NINTENDO6" language="En" edition="1st">
      <title>The NES Encyclopedia</title>
      <author>Chris Scullion</author>
      <isbn>978-1525302381</isbn>
      <sku>1525302388</sku>
      <description>The NES is one of the most iconic video game systems of all time, and is credited with ‘saving’ the American video games industry in the early 80s when it looked likely to collapse.</description>
      <price currency="USD">34</price>
      <department>NINTENDO</department>
      <modules>
        <module id="NINTENDO" name="NINTENDO 101"/>
      </modules>
      <availability>In Stock</availability>
      <condition>New</condition>
      <image>NINTENDO.png</image>
    </product>

    <product id="NINTENDO7" language="En" edition="1st">
      <title>The Art of Super Mario Odyssey</title>
      <author>Cathy Ballou Mealey</author>
      <isbn>978-1525302381</isbn>
      <sku>1525302388</sku>
      <description>A book about Mario</description>
      <price currency="USD">13</price>
      <department>NINTENDO</department>
      <modules>
        <module id="NINTENDO" name="NINTENDO 101"/>
      </modules>
      <availability>In Stock</availability>
      <condition>Good</condition>
      <image>NINTENDO.png</image>
    </product>

    <product id="NINTENDO8" language="En" edition="1st">
      <title>The Big Book of Nintendo</title>
      <author>Future Publishing Ltd</author>
      <isbn>978-1525302381</isbn>
      <sku>1525302388</sku>
      <description>Explore Nintendo's journey from an obscure Kyoto-based company to global videogaming powerhouse through some of their most iconic games and consoles.</description>
      <price currency="USD">21</price>
      <department>NINTENDO</department>
      <modules>
        <module id="NINTENDO" name="NINTENDO 101"/>
      </modules>
      <availability>Out of Stock</availability>
      <condition>Fine</condition>
      <image>NINTENDO.png</image>
    </product>

    <product id="NINTENDO9" language="En" edition="1st">
      <title>The N64 Encyclopedia</title>
      <author>Chris Scullion </author>
      <isbn>978-1525302381</isbn>
      <sku>1525302388</sku>
      <description>The fourth book in Chris Scullion’s critically acclaimed series of video game encyclopedias, The N64 Encyclopedia is dedicated to the Nintendo 64, one of the most well-loved games consoles ever released. </description>
      <price currency="USD">30</price>
      <department>NINTENDO</department>
      <modules>
        <module id="NINTENDO" name="NINTENDO 101"/>
      </modules>
      <availability>In Stock</availability>
      <condition>Great</condition>
      <image>NINTENDO.png</image>
    </product>

    <product id="NINTENDO10" language="En" edition="1st">
      <title>Seeing Red: Nintendo's Virtual Boy</title>
      <author>Jose P. Zagal</author>
      <isbn>978-1525302381</isbn>
      <sku>1525302388</sku>
      <description>The curious history, technology, and technocultural context of Nintendo’s short-lived stereoscopic gaming console, the Virtual Boy.</description>
      <price currency="USD">30</price>
      <department>NINTENDO</department>
      <modules>
        <module id="NINTENDO" name="NINTENDO 101"/>
      </modules>
      <availability>Out of Stock</availability>
      <condition>Used</condition>
      <image>NINTENDO.png</image>
    </product>
  </products>
</store>